Pergunte aos ateus,Ateísmo e Agnosticismo
Discovering the Joy of Radiointernetowe - A Perfect Blend of Music and Connectivity!,Ateísmo e Agnosticismo
A elitização do ateísmo,Ateísmo e Agnosticismo
Ciência e Fé conflitam ou não?,Ateísmo e Agnosticismo
Agnosticismo não é meio termo entre Ateísmo e Teísmo!,Ateísmo e Agnosticismo
Existe ex-ateu?,Ateísmo e Agnosticismo
Tentar provar Deus vai contra a fé!,Ateísmo e Agnosticismo
O Panteísmo é uma forma de ateísmo?,Ateísmo e Agnosticismo
[Exercício Filosófico] Conhecimento requer crença?,Ateísmo e Agnosticismo
Livre Arbítrio,Ateísmo e Agnosticismo
"""Problema do Mal""",Ateísmo e Agnosticismo
"por que se definir como ""ateu""?",Ateísmo e Agnosticismo
Satanás e a expulsão do céu,Ateísmo e Agnosticismo
Medicina alternativa e pseudociências,Ceticismo
Estranhos mistérios estranhamente misteriosos,Ceticismo
Estudos científicos sobre o paranormal,Ceticismo
Parapsicologia,Ceticismo
O Mundo tem um Logos,Ceticismo
Deus existe ?,Ceticismo
Vida extraterrestre? A verdade está lá fora?,Ceticismo
Lei da atração,Ceticismo
Astrologia,Ceticismo
O Homem de Piltdown,Ceticismo
Ceticismo,Ceticismo
Análise sobre a Mentira,Ceticismo
"UFOs / OVNIs e outras coisas ""extraterrestres""",Ceticismo
Picaretas & Picaretagens,Ceticismo
Novidades Arqueológicas,Ceticismo
Viagem Astral,Ceticismo
Construções Megalíticas do Passado,Ceticismo
[Arqueologia] O Mistério das Bolsas,Ceticismo
Túmulo de Jesus?,Ceticismo
"Contato Imediato...se ocorrer, como é que fica?",Ceticismo
Tinha que ser lei,Ceticismo
"Viagem no tempo - realidade, ficção e picaretagem",Ceticismo
Você é um Quack? (Charlatão),Ceticismo
Eram os Deuses Astronautas?,Ceticismo
Tópico quanticamente energizado,Ceticismo
Experiências Sobrenaturais,Ceticismo
Sobre Publius Lentulus e a aparencia de JC,Ceticismo
Livros e links sobre Ceticismo,Ceticismo
O Problema da Identidade Pessoal,Ceticismo
Anjos e Demônios,Ceticismo
DocFake,Ceticismo
Argumentos Antifisicalistas,Ceticismo
O guia de bolso para prevenção de besteiras,Ceticismo
Homeopatia,Ceticismo
Telecinesia existe?,Ceticismo
"“As pessoas resistem à ideia, mas a vida é só química”, diz vencedor do Nobel",Ceticismo
O Mundo Assombrado pelos Demônios,Ceticismo
Antigo Egito - Tópico Oficial,Ceticismo
Sinais de antiga superinteligência de máquina pós-biológica,Ceticismo
Religiosidade pseudo-científica,Ceticismo
Pesquisadores descobrem sistema de filtragem de água Maya de 2.000 anos,Ceticismo
Questionando o Pseudo-ceticismo,Ceticismo
Bullshido - Baboseira em artes marciais,Ceticismo
O experimento do Cérebro Chinês,Ceticismo
Cérebros de Boltzmann,Ceticismo
Ilusões de Tempo - Perspectiva psicológica,Ceticismo
"""Profecias"" genéricas",Ceticismo
As linhas de Nazca - Novas descobertas,Ceticismo
"Charlatanismo, Curandeirismo e Fraudes Espirituais",Ceticismo
"Céticos seletivos: Negacionistas, pseudo-científicos, etc",Ceticismo
Ataques hackers: Ransomware e outros malwares causando prejuízos enormes,"Ciência, Tecnologia e Saúde"
Cibersegurança: o que é essencial como ferramenta de proteção?,"Ciência, Tecnologia e Saúde"
Diabetes ou Resistência à Insulina?,"Ciência, Tecnologia e Saúde"
Inteligência artificial - Generalidades,"Ciência, Tecnologia e Saúde"
"Poluição (ar, solo e água)","Ciência, Tecnologia e Saúde"
"Sustentabilidade: Energias alternativas, etc.","Ciência, Tecnologia e Saúde"
Mudanças Climáticas,"Ciência, Tecnologia e Saúde"
Comida orgânica e volta à vida natural,"Ciência, Tecnologia e Saúde"
Experiencia confirma minha teoria de que a lei de Coulomb é incompleta,"Ciência, Tecnologia e Saúde"
Engenharia,"Ciência, Tecnologia e Saúde"
Inteligência Artificial - WebChatGPT - Uma revolução na escrita,"Ciência, Tecnologia e Saúde"
Inteligência Artificial - Criação de imagens,"Ciência, Tecnologia e Saúde"
"Dimensões ocultas, perceptíveis e meu modelo dimensional","Ciência, Tecnologia e Saúde"
Uso de computador com o Sistema Operacional na Nuvem,"Ciência, Tecnologia e Saúde"
Destruindo as baboseiras ditas sobre a eficácia e a segurança de vacinas anti-COVID,"Ciência, Tecnologia e Saúde"
Mudança no sistema educacional brasileiro,"Ciência, Tecnologia e Saúde"
Mitos alimentares,"Ciência, Tecnologia e Saúde"
Água,"Ciência, Tecnologia e Saúde"
O dilema das redes sociais,"Ciência, Tecnologia e Saúde"
Coronavirus - Covid-19 (Aspectos científicos),"Ciência, Tecnologia e Saúde"
Embalagens e utensílios que intoxicam,"Ciência, Tecnologia e Saúde"
Outras epidemias (além da Covid),"Ciência, Tecnologia e Saúde"
Oceano Pacífico e Theia,"Ciência, Tecnologia e Saúde"
Fenômenos geológicos,"Ciência, Tecnologia e Saúde"
Tratamentos naturais: Homeopatia ou medicina de fato?,"Ciência, Tecnologia e Saúde"
Corrupção na indústria farmacêutica,"Ciência, Tecnologia e Saúde"
Câncer,"Ciência, Tecnologia e Saúde"
Questões de saúde - Dicas e hábitos saudáveis,"Ciência, Tecnologia e Saúde"
"Coronavirus - Covid-19 (Medidas sanitárias, lockdown, corrupção)","Ciência, Tecnologia e Saúde"
Astronomia,"Ciência, Tecnologia e Saúde"
Ferrovias,"Ciência, Tecnologia e Saúde"
Energia nuclear,"Ciência, Tecnologia e Saúde"
Quatro falácias da psicologia evolutiva pop,"Ciência, Tecnologia e Saúde"
"Recordes na Ciência, Tecnologia e Saúde","Ciência, Tecnologia e Saúde"
Vida: Origem? Por que ela existe?,"Ciência, Tecnologia e Saúde"
Exemplos de revisão de algumas Leis da Física,"Ciência, Tecnologia e Saúde"
Fermilab reforça raio do próton calculado no livro “Sutil é a matemática”,"Ciência, Tecnologia e Saúde"
Uma bala de prata contra a COVID-19 chamada máscara,"Ciência, Tecnologia e Saúde"
Talvez experiencia possa medir a carga elétrica dos férmions do vácuo quântico,"Ciência, Tecnologia e Saúde"
Ciência no Brasil,"Ciência, Tecnologia e Saúde"
Teria Deus usado o número imaginário i ?,"Ciência, Tecnologia e Saúde"
Tempo,"Ciência, Tecnologia e Saúde"
Cargas elétricas,"Ciência, Tecnologia e Saúde"
Ondas Gravitacionais,"Ciência, Tecnologia e Saúde"
"Gabarito, a Conspiração do Silêncio não ocorre só no Cluble Ceticismo","Ciência, Tecnologia e Saúde"
Consciência e seus desdobramentos,"Ciência, Tecnologia e Saúde"
Bohr e a Conspiração,"Ciência, Tecnologia e Saúde"
O complexo tupiniquim de inferioridade dos brasileiros,"Ciência, Tecnologia e Saúde"
Pedido ao Presidente Lula,"Ciência, Tecnologia e Saúde"
Um dos mais impressionantes cálculos da Física Teórica,"Ciência, Tecnologia e Saúde"
Feminismo e ideologia de gênero,"História, Sociedade, Comportamento e Filosofia"
Federação Russa,"História, Sociedade, Comportamento e Filosofia"
Aporofobia - a aversão ao pobre,"História, Sociedade, Comportamento e Filosofia"
O Caso Marcius Melhem,"História, Sociedade, Comportamento e Filosofia"
"Crimes Cometidos por Forças de Segurança - Polícia: ""Heróis""? (Violência Policial)","História, Sociedade, Comportamento e Filosofia"
Dificuldades do passado - Facilidades do presente (Jovens da nova geração),"História, Sociedade, Comportamento e Filosofia"
Racismo,"História, Sociedade, Comportamento e Filosofia"
"Golpes, scams, etc","História, Sociedade, Comportamento e Filosofia"
Crimes cotidianos - Notícias do dia-a-dia na bandidagem,"História, Sociedade, Comportamento e Filosofia"
Criminalidade,"História, Sociedade, Comportamento e Filosofia"
Problemas demográficos / populacionais,"História, Sociedade, Comportamento e Filosofia"
"Imigração, refugiados, etc.","História, Sociedade, Comportamento e Filosofia"
"Censura do Politicamente Correto - Batalha de estátuas, apagar a história","História, Sociedade, Comportamento e Filosofia"
Drogas: libera geral?,"História, Sociedade, Comportamento e Filosofia"
"""Doutrinação Esquerdista"" (Universidades)","História, Sociedade, Comportamento e Filosofia"
Ambientes de esquerda e de direita,"História, Sociedade, Comportamento e Filosofia"
O que é a moral?,"História, Sociedade, Comportamento e Filosofia"
Homofobia,"História, Sociedade, Comportamento e Filosofia"
"Protestos, manifestações, vandalismo, antifas, Blacks live matter, etc","História, Sociedade, Comportamento e Filosofia"
Os cenários para a extinção da humanidade,"História, Sociedade, Comportamento e Filosofia"
Arrependimento e Perdão,"História, Sociedade, Comportamento e Filosofia"
Ancestralidade genética do povo brasileiro,"História, Sociedade, Comportamento e Filosofia"
O que significa metafísica?,"História, Sociedade, Comportamento e Filosofia"
Aborto: sim ou não,"História, Sociedade, Comportamento e Filosofia"
Memória afetiva: Passado amenizado ou idealizado,"História, Sociedade, Comportamento e Filosofia"
Porte e posse de armas: prós e contras,"História, Sociedade, Comportamento e Filosofia"
Teria sido melhor se os europeus não tivessem colonizado...,"História, Sociedade, Comportamento e Filosofia"
Pais e filhos - educação.,"História, Sociedade, Comportamento e Filosofia"
Índice de felicidade,"História, Sociedade, Comportamento e Filosofia"
Meritocracia,"História, Sociedade, Comportamento e Filosofia"
O nada existe?,"História, Sociedade, Comportamento e Filosofia"
Hábito de leitura da população,"História, Sociedade, Comportamento e Filosofia"
Sistema de medidas,"História, Sociedade, Comportamento e Filosofia"
Povos indígenas das Américas,"História, Sociedade, Comportamento e Filosofia"
A automação causará desemprego. Qual é a solução?,"História, Sociedade, Comportamento e Filosofia"
O dilema do bonde - Podemos sacrificar uma pessoa para salvar várias?,"História, Sociedade, Comportamento e Filosofia"
A ética do uso de embriões humanos como cobaia (edição genética),"História, Sociedade, Comportamento e Filosofia"
Eugenia,"História, Sociedade, Comportamento e Filosofia"
Por que algumas das pessoas mais inteligentes podem ser tão estúpidas,"História, Sociedade, Comportamento e Filosofia"
Denúncias e Engajamento das Tias do Zapzap,"História, Sociedade, Comportamento e Filosofia"
Pobre de direita e rico de esquerda,"História, Sociedade, Comportamento e Filosofia"
"A religião é uma mentira, mas a sociedade é pior sem religião","História, Sociedade, Comportamento e Filosofia"
Holodomor,"História, Sociedade, Comportamento e Filosofia"
Quer ser corrupto? Vá para a universidade pública,"História, Sociedade, Comportamento e Filosofia"
Ateu Conservador,"História, Sociedade, Comportamento e Filosofia"
Quem são os influencers de esquerda que levam o marxismo para as redes sociais,"História, Sociedade, Comportamento e Filosofia"
Cultura industrial de massa,"História, Sociedade, Comportamento e Filosofia"
Guerra e conflitos militares,"História, Sociedade, Comportamento e Filosofia"
A situação da cultura pop,"História, Sociedade, Comportamento e Filosofia"
Conflitos Árabes-Judeus,"História, Sociedade, Comportamento e Filosofia"
Venezuela,"Laicismo, Política e Economia"
Dossiê Jair Bolsonaro: seus crimes e desonestidades,"Laicismo, Política e Economia"
Governo Lula - Alckmin,"Laicismo, Política e Economia"
Viagens de Lula no seu 3º governo,"Laicismo, Política e Economia"
Liberalismo e Anarcocapitalismo,"Laicismo, Política e Economia"
Plutocracia e sistema de democracia ocidental,"Laicismo, Política e Economia"
Proposta de desenvolvimentismo brasileiro,"Laicismo, Política e Economia"
Bolsa de valores,"Laicismo, Política e Economia"
Estados Unidos da América,"Laicismo, Política e Economia"
Leis trabalhistas,"Laicismo, Política e Economia"
República de Cuba,"Laicismo, Política e Economia"
Privilégios/mordomias do serviço público e falta de ética de autoridades,"Laicismo, Política e Economia"
Socialismo e Comunismo,"Laicismo, Política e Economia"
Reinaldo Azevedo: petista acidental,"Laicismo, Política e Economia"
Proposta de divisão de municípios,"Laicismo, Política e Economia"
As Bobagens de Mario Sergio Cortella,"Laicismo, Política e Economia"
Assuntos relacionados à Lava Jato,"Laicismo, Política e Economia"
República Popular da China - A China vai dominar o mundo?,"Laicismo, Política e Economia"
"Imposto, taxa, tributos, etc","Laicismo, Política e Economia"
Liberdade de expressão,"Laicismo, Política e Economia"
"O subemprego do Uber e do iFood é um problema, mas não é culpa do ""capitalismo""","Laicismo, Política e Economia"
Política + Religião = Justificativa pra picaretas,"Laicismo, Política e Economia"
Dependência econômica global,"Laicismo, Política e Economia"
"Direita, esquerda e centro","Laicismo, Política e Economia"
Privatizações,"Laicismo, Política e Economia"
Bitcoin e outras criptomoedas,"Laicismo, Política e Economia"
Separatismo no Brasil,"Laicismo, Política e Economia"
"Totalitarismo: Fascismo, Nazismo e Socialismo","Laicismo, Política e Economia"
Coréia do Norte,"Laicismo, Política e Economia"
Caso Gabriel Monteiro: sempre desconfie de um idealista que lucra com seus ideais,"Laicismo, Política e Economia"
Estado de Israel,"Laicismo, Política e Economia"
Islã; Terrorismo islâmico; Censura a charges,"Laicismo, Política e Economia"
Lula,"Laicismo, Política e Economia"
Fake News da Esquerda nunca desmentidas.,"Laicismo, Política e Economia"
Validade (obsolescência) programada,"Laicismo, Política e Economia"
"Problemas habitacionais: Política sobre crise e especulação imobiliária, etc","Laicismo, Política e Economia"
Ministérios,"Laicismo, Política e Economia"
Vertente da militância “liberal” e “conservadora” que virou “bolsominion” ou coisa assemelhada,"Laicismo, Política e Economia"
Por que estamos empobrecendo? (2019),"Laicismo, Política e Economia"
Questão dos combustíveis,"Laicismo, Política e Economia"
Japão,"Laicismo, Política e Economia"
Liberais Brasileiros,"Laicismo, Política e Economia"
Ecologia x Economia,"Laicismo, Política e Economia"
"Questões de saúde - Sistemas, planos, políticas públicas","Laicismo, Política e Economia"
Corrupção,"Laicismo, Política e Economia"
"Patente: Quebrar, manter, ou depende da situação?","Laicismo, Política e Economia"
Favelas,"Laicismo, Política e Economia"
"Tá tudo errado! Aristocracia brasileira, ideologias, etc...","Laicismo, Política e Economia"
Monarquia,"Laicismo, Política e Economia"
Governo Trump,"Laicismo, Política e Economia"
Evolução e dispersão dos HOMINÍDEOS,Origens e Evolução
Teoria da evolução,Origens e Evolução
"Cosmologia: Argumento cosmológico, Criacionismo, etc",Origens e Evolução
Materialismo,Origens e Evolução
Argumento da Simulação,Origens e Evolução
Hipótese de cruzamento entre hominídeos em diferentes continentes,Origens e Evolução
Mania Antrópica - A Vida Sempre Será Tal Como Se Deus Existisse,Origens e Evolução
Cientistas apresentam ADN mais antigo do mundo,Origens e Evolução
O Sofrimento na Natureza,Origens e Evolução
Blob (Physarum polycephalum): Ser misterioso com 720 sexos e sem cérebro,Origens e Evolução
Reflexões antimaterialistas,Origens e Evolução
Neandertais fizeram duas migrações para a Sibéria.,Origens e Evolução
Exobiologia,Origens e Evolução
"Religiões - Escândalos, Crises e Decepções","Religiões, Crenças e Mitos"
História da Bíblia - Como foi escrita,"Religiões, Crenças e Mitos"
Cultos e fanatismo,"Religiões, Crenças e Mitos"
"Sincretismo entre cristianismo, islamismo e judaísmo","Religiões, Crenças e Mitos"
"""Polêmico"" - Jesus efetivamente existiu?","Religiões, Crenças e Mitos"
Carma - A lei espiritual da ação e reação,"Religiões, Crenças e Mitos"
"Influência/proselitismo de religiões ou religiosos (tentativa de proselitismo, apelo emocional, chantagens etc).","Religiões, Crenças e Mitos"
Jesus morreu para nos salvar,"Religiões, Crenças e Mitos"
Criacionismo / Design Inteligente,"Religiões, Crenças e Mitos"
"Os papas, de Pedro até hoje","Religiões, Crenças e Mitos"
Identidade pessoal e reencarnação,"Religiões, Crenças e Mitos"
(Jesus não voltará) Mateus 16: 28,"Religiões, Crenças e Mitos"
Teologia da prosperidade,"Religiões, Crenças e Mitos"
Previsões e profecias,"Religiões, Crenças e Mitos"
"Judeus, do politeísmo ao monoteísmo","Religiões, Crenças e Mitos"
Amish,"Religiões, Crenças e Mitos"
Espiritismo -Temas genéricos,"Religiões, Crenças e Mitos"
"""Coincidências"" ou empréstimos míticos e religiosos","Religiões, Crenças e Mitos"
Sensações de vidas passadas,"Religiões, Crenças e Mitos"
A Crença na vida após a morte,"Religiões, Crenças e Mitos"
Religião e Racismo,"Religiões, Crenças e Mitos"
O que é Deus?,"Religiões, Crenças e Mitos"
Demolindo o dogma da Santíssima Trindade,"Religiões, Crenças e Mitos"
Quatro mulheres na minha vida marcada pelo número quatro,"Religiões, Crenças e Mitos"
... de onde viria o Inteligent Design...?,"Religiões, Crenças e Mitos"
Curiosidades religiosas ou filosóficas,"Religiões, Crenças e Mitos"
Coisas que um padreco ou pastor jamais contarão aos seus fieis,"Religiões, Crenças e Mitos"
Movimento Modernista - quando a ICAR deu um tiro no pé,"Religiões, Crenças e Mitos"
Pergunte a um Místico,"Religiões, Crenças e Mitos"
O Jesus historico vs o Jesus do mito,"Religiões, Crenças e Mitos"
Crianças morrem de fome graças a Deus,"Religiões, Crenças e Mitos"
O Inferno existe?,"Religiões, Crenças e Mitos"
Teocracia - Crentes vão se tornar maioria no Brasil,"Religiões, Crenças e Mitos"
Notícias ruins atestam a falta de consideração de um possível Deus?,"Religiões, Crenças e Mitos"
"Frases, fatos, situações ridículas dos crentes","Religiões, Crenças e Mitos"
Espiritismo brasileiro é um catolicismo que acredita na reencarnação. Conflito entre espíritas.,"Religiões, Crenças e Mitos"
Práticas Religiosas,"Religiões, Crenças e Mitos"
Pergunte a um Rosacruz,"Religiões, Crenças e Mitos"
Cristianismo crítico,"Religiões, Crenças e Mitos"
Interpretações e visões diferentes de passagens da Bíblia e outras religiões,"Religiões, Crenças e Mitos"
5 mandamentos maquiavelicos para a criação de qualquer religiao com potencial para dominar o mundo,"Religiões, Crenças e Mitos"
Como Deus é maravilhoso!,"Religiões, Crenças e Mitos"
"Deus (cristão) nunca tem nem teve culpa de nada nas crueldades...(históricas, bíblicas, pragas, vírus, doenças, etc etc.","Religiões, Crenças e Mitos"
A maldição de Canaã,"Religiões, Crenças e Mitos"
O que os líderes religiosos fariam se os extraterrestres aparececem?,"Religiões, Crenças e Mitos"
O que achamos do Natal,"Religiões, Crenças e Mitos"
Manifestações exageradas em ritos e cultos religiosos,"Religiões, Crenças e Mitos"
Besteiras e absurdos em livros espíritas (pelo menos é o que parece...),"Religiões, Crenças e Mitos"
O que te fez abandonar a religião X?,"Religiões, Crenças e Mitos"
"Parabola das dez virgens, contada por Jesus - foi mesmo uma ""festa com convidados"" ?!","Religiões, Crenças e Mitos"
Plano mundial comunista contra cristianismo e liberdade individual,Teorias da conspiração
Conspiracionismo político,Teorias da conspiração
"Globalismo anticristão / 666: Papa, internet, Vale do silício, etc.",Teorias da conspiração
Georges Soros: Financiador da esquerda global,Teorias da conspiração
Terra Plana - Tópico de refutações,Teorias da conspiração
Factcheck e catálogos de sites com conteúdos conspiracionistas,Teorias da conspiração
A Internet e as Teorias da Conspiração,Teorias da conspiração
Fósseis de gigantes,Teorias da conspiração
Conspiracionismo sobre Fraudes eleitorais,Teorias da conspiração
Fraude eleitoral eletrônica,Teorias da conspiração
World Map: Vibe of Cosmos,Teorias da conspiração
Conspiração Coronavirus,Teorias da conspiração
Protocolos dos Sábios de Sião 2.0,Teorias da conspiração
Project Blue Beam | The Fake Alien Invasion,Teorias da conspiração
Kookmobiles,Teorias da conspiração
Profecias do Arcanjo Lúcifer,Teorias da conspiração
Q-Anon,Teorias da conspiração
O Grande Reset (O Grande Reinício),Teorias da conspiração
Queima de arquivo ou assassinato em série de libertários e simpatizantes ilustres,Teorias da conspiração
MK Ultra: CIA mind control program in Canada (1980),Teorias da conspiração
microwave attacks,Teorias da conspiração
Cicada 3301 - Mistério na Internet,Teorias da conspiração
11B-X-1371,Teorias da conspiração
"Bill Gates investe em projeto para ""escurecer"" o Sol contra o aquecimento global",Teorias da conspiração
Fim do mundo,Teorias da conspiração
Antivacinação,Teorias da conspiração
Conspiritualidade,Teorias da conspiração
O caráter intelectual dos teóricos da conspiração,Teorias da conspiração
O que diferencia impeachment de golpe?,Teorias da conspiração
Conspirações Geográficas Terrenas e Extraterrenas,Teorias da conspiração
Pentágono divulga vídeos de OVNIs,Teorias da conspiração
Caso Jeffrey Epstein,Teorias da conspiração
O Experimento Philadelphia,Teorias da conspiração
Torres Gêmeas - WTC,Teorias da conspiração
Vespas Asiáticas Gigantes,Teorias da conspiração
Tópico da paranóia viral. Cenários apocalípticos,Teorias da conspiração
